{
  "$schema": "https://json-schema.org/draft/2020-12/schema",
  "$id": "diff-review-walkthrough.schema.json",
  "title": "DiffReview Walkthrough",
  "description": "Guided review walkthrough of a set of changes, consumed by the DiffReview Neovim plugin. Lives at the repository root as .walkthrough.json.",
  "type": "object",
  "required": ["version", "summary", "commit", "steps"],
  "additionalProperties": false,
  "properties": {
    "version": {
      "const": 1
    },
    "summary": {
      "type": "string",
      "minLength": 1,
      "description": "High-level prose summary of the whole change set. Newlines allowed."
    },
    "commit": {
      "type": "string",
      "pattern": "^[0-9a-fA-F]{40}$",
      "description": "Full sha of HEAD at generation time (git rev-parse HEAD). Used for staleness detection; positions describe the working tree as it existed on top of this commit."
    },
    "steps": {
      "type": "array",
      "minItems": 1,
      "items": { "$ref": "#/$defs/step" }
    }
  },
  "$defs": {
    "position": {
      "type": "object",
      "required": ["line", "col"],
      "additionalProperties": false,
      "properties": {
        "line": {
          "type": "integer",
          "minimum": 1,
          "description": "1-based line in the NEW (post-change) file as it exists on disk"
        },
        "col": {
          "type": "integer",
          "minimum": 1,
          "description": "1-based column (byte offset) in that line"
        }
      }
    },
    "step": {
      "type": "object",
      "required": ["file", "start", "end", "comment"],
      "additionalProperties": false,
      "properties": {
        "file": {
          "type": "string",
          "minLength": 1,
          "description": "Repo-relative path with forward slashes"
        },
        "start": {
          "$ref": "#/$defs/position",
          "description": "Start of the referenced region. The line should be a CHANGED (added) line, not unchanged context - reviewers are jumped to it inside the diff."
        },
        "end": {
          "$ref": "#/$defs/position",
          "description": "Inclusive end of the referenced region; must be >= start. Keep the region tight around the discussed change (roughly 40 lines at most)."
        },
        "comment": {
          "type": "string",
          "minLength": 1,
          "description": "What this step changes and why; 1-4 sentences. By convention begins with the step's repo-root-relative file path (e.g. \"src/router.rs: ...\") so the comment reads standalone."
        },
        "title": {
          "type": "string",
          "description": "Optional short step heading"
        }
      }
    }
  }
}
